,ID,NOME,ENDERECO,longitude,latitude
0,1,Monteiro Lobato (Inclui Ônibus Biblioteca),"R Gal Jardim, 485",-46.649495184223206,-23.545050152521288
1,2,CEU Três Pontes,"R Capachós, s/n",-46.38171289713914,-23.478445335650882
2,3,Paulo Leminski - CEU Parque Veredas,"R Daniel Pedro Muller, s/n- Camargo Velho",-46.39019014094071,-23.513291550505617
3,4,Ponto de Leitura Severino do Ramo,"R Barão de Alagoas, 340",-46.397535213465304,-23.49824842996539
4,5,Ponto de Leitura André Vital,"Av dos Metal·rgicos, 2255",-46.399388770748,-23.60093108652187
5,6,CEU Lajeado,"R Manuel da Mota Coutinho, 293",-46.40098847709358,-23.544646656313258
6,7,Ponto de Leitura Parque do Rodeio,"R Igarapé da Bela Aurora, s/n",-46.40428473983689,-23.57514780829886
7,8,Bosque de Leitura Parque Lajeado,"R Antônio Thadeu, 74",-46.40572858607984,-23.54395364664823
8,9,CEU Água Azul,"Av dos Metal·rgicos, 1262",-46.40666488472179,-23.594178915333103
9,10,Ponto  de Leitura Juscelino Kubitschek,"R Inácio Monteiro, 55",-46.40769871587223,-23.56402474324187
10,11,Cora Coralina,"R Otelo A. Ribeiro, 113",-46.41008469445341,-23.5447065831309
11,12,Jamil Almansur Haddad,"R Andes, 491-A",-46.410144686960386,-23.537536534557823
12,13,Adelaide de Castro Alves Guimarães - CEU Inácio Monteiro,"R Br Barroso do Amazonas, s/n -  Prestes Maia",-46.41184381089961,-23.57009575355702
13,14,João Cabral de Mello Neto - CEU Vila Curuþß,"Av Marechal Tito, 3.400 -V. Curucá",-46.41259152825108,-23.49536029811859
14,15,Vicente Paulo Guimarães,"R Jaguar, 225",-46.421024697842235,-23.501781286605045
15,16,Ponto de Leitura Vila Mara,"R Conceicão do Almeida, 170",-46.42182666198664,-23.49192016818394
16,17,Eugênia Alvaro Moreyra - CEU Jambeiro,"R Flores do Jambeiro, 61 - Guaianases",-46.422876920739,-23.539289438483866
17,18,CEU Alto Alegre,"R Bento Guelfi, s/n",-46.42711725493302,-23.60955386056061
18,19,Ponto de Leitura Tide Setubal,"R Mario Dalari, 170",-46.429831819599336,-23.498886167279167
19,20,Vinicius de Morais,"R Jardim Tamoio, 1.119 - Itaquera II",-46.43612420115309,-23.55373044002689
20,21,Raimundo de Menezes,"Av Nordestina, 780",-46.43764794911762,-23.49532004559235
21,22,Vicente de Carvalho,"R Guilherme ValÛncia, 210",-46.44064826003711,-23.55006837287855
22,23,Ponto de Leitura Jardim Lapenna,"R Serra da Juruoca, s/n - Jardim Lapenna - São  Miguel Paulista",-46.44955113172352,-23.487640905928295
23,24,Camilo Pedro dos Reis - CEU São  Mateus,"R Curumatim, 201 - Pque Boa Esperança",-46.44956570485895,-23.60258767273772
24,25,Sergio Buarque de Holanda,"R Victório Santim, 44",-46.45469039412327,-23.53667121876396
25,26,Mario Palmério - CEU São  Rafael,"R Cinira Polônio, 100 - j. Rio Claro",-46.456739865223405,-23.62045270814776
26,27,CEU Azul da Cor do Mar,"Av Ernesto Souza Cruz, 2171",-46.45738937934856,-23.521901100992327
27,28,Bosque de Leitura do Carmo,"Av Afonso de Sampaio e Souza, 951",-46.469017873034694,-23.57042930387774
28,29,Ponto de Leitura São Mateus ( Inaug. 16-12-10),"R Fortaleza de Itapema, 268",-46.472158126126956,-23.618171559047894
29,30,Barbosa Lima Sobrinho CEU Parque São  Carlos,"R Clarear, 141 - Jdim. São  Carlos",-46.47384367438928,-23.509963888736227
30,31,Rubens Borba Morais,"R Sampei Sato, 440",-46.48074466690988,-23.486448696337472
31,32,Jovina Rocha Alvares  Pessoa,"Av Padre Francisco de Toledo, 331 - Cohab I",-46.48507604002106,-23.546511069137004
32,33,CEU Sapopemba,R Manuel Quirino de Mattos com R Victoria Marconato Santos,-46.4944315581468,-23.60958833823108
33,34,CEU Quinta do Sol,Av Luís Imparato com Av Olavo Egídio de Souza Aranha,-46.49627794449482,-23.49837164673122
34,35,Juo Bananere - CEU Rosa da China,"R Clara Petrella, s/n - Jd. São  Roberto",-46.500895653379466,-23.62147537525107
35,36,Mario Quintana - CEU Aricanduva,"Av Olga Fadel Abarca, s/n - Av Aricanduva, alt. 5555 - quadra 280",-46.50347249700201,-23.570677047065324
36,37,Milton Santos,"Av Aricanduva, 5.777",-46.50385545968497,-23.57036602761057
37,38,Gilberto Freyre,"R José Joaquim, 290",-46.51709895400799,-23.60117214890209
38,39,CEU Formosa,"R Sargento Claudiner Evaristo Dias, s/n",-46.52423994015591,-23.5802139827722
39,40,Lenyra Fraccaroli,"Pc Haroldo Daltro, 451",-46.5321359009514,-23.546937739430593
40,41,Paulo Setúbal,"Av Renata, 163",-46.540581194696784,-23.571829920076663
41,42,Zanoni Ferrite,"Av Renata, 163",-46.540581194696784,-23.571829920076663
42,43,Aureliano Leite,"R Otto Schubart, 196",-46.54812251132007,-23.59507397956674
43,44,Biblioteca José Paulo Paes,"Lg do Rosário, 20, 3 andar",-46.54873312437462,-23.525862573624803
44,45,CEU Tiquatira,"Av Condessa Elizabeth Robiano com R Kampala, 270",-46.55483512987969,-23.518106499012777
45,46,Bosque de Leitura Parque Esportivo do Trabalhador,"R Canuto Abreu, s/n",-46.559148449716346,-23.55594273055835
46,47,CEU Tiquatira,"Av. Condessa Elizabeth Robiano, s/n",-46.560571262435616,-23.52559946291599
47,48,José Mauro de Vasconcelos,"Pc Cmte. Eduardo Oliveira, s/n",-46.56501202258819,-23.476937108653264
48,49,Cassiano Ricardo (Temática em Música - 10/11/2007),"Av Celso Garcia, 4.200",-46.57220859216172,-23.536151530280865
49,50,Hans Christian Andersen (Temática em Contos de Fadas - 10/11/2007),"Av Celso Garcia, 4.142",-46.57255962563726,-23.536299514352372
50,51,Bosque de Leitura Guarapiranga,"Praça Ituzaingo, s/n",-46.57316378339578,-23.552778589430684
51,52,Paulo Sergio Milliet,"Pça. Ituzaingó, s/n",-46.57316378339578,-23.552778589430684
52,53,Ponto de Leitura Parque do Piqueri,"R Tuiuti, 515",-46.57556763664872,-23.52936940956591
53,54,Prof. Arnaldo Magalhães Giácomo,"R Restinga, 136",-46.5810787840886,-23.539867443317952
54,55,Ricardo Ramos,"Pc Centenário de Vila Prudente, 25",-46.58350320178743,-23.581914767394213
55,56,Wally Salomão - CEU Meninos,"R Barbinos, 112 - J. Patente",-46.583672521150696,-23.621384964561212
56,57,CEU Jacanã,"R Antonio Cezar Neto, 105",-46.584908257487214,-23.457359890782147
57,58,Castro Alves,"R Abrahao Mussa, s/n",-46.59052774890016,-23.63140599668269
58,59,Alvares  de Azevedo,Pc Joaquim José da Nova s/n,-46.59278772597675,-23.503930169724537
59,60,Affonso Taunay,"R Taquari, 549",-46.598204174356624,-23.551217425906735
60,61,Distribuição dos Ônibus Bibliotecas,"R Taquari, 549",-46.598204174356624,-23.551217425906735
61,62,Bosque de Leitura Parque do Trote,"R São Quirino, 905",-46.598257943113744,-23.514781213050533
62,63,Roberto Santos (Temática em Cinema - inaug. 14-6-2008),"R Cisplatina, 505",-46.602646649312284,-23.587667654362605
63,64,Sylvia Orthof,"Av Tucuruvi, 808",-46.60477678788568,-23.481691978021708
64,65,Bosque de Leitura Parque Lions(Tucuruvi),"R Alcindo Bueno de Assis, 500",-46.60681469716821,-23.46777981335727
65,66,CEU Parque Bristol,R Professor Arthur Primavesi com R Roudão Eufrázio Leal,-46.60921625484803,-23.643705003514057
66,67,Biblioteca Adelpha Figueiredo,"Pc Ilo Otani, 146",-46.61105928095235,-23.526550266164584
67,68,Amadeu Amaral,R José Clóvis Castro s/n,-46.61667113190374,-23.612533742138076
68,69,Nuto Sant'Anna,"Pc Tenório Aguiar, 32",-46.619827128431304,-23.498514047779523
69,70,Chácara do Castelo,"R Brás Lourenço, 333",-46.623700987171304,-23.58363556165795
70,71,Biblioteca de São Paulo - Parque da Juventude,"Av Cruzeiro do Sul, 2630",-46.62492932526581,-23.508425042206152
71,72,Zalina Rolim,"R Corredeira, 26",-46.626304188207726,-23.59953261699961
72,73,Arquivo do Estado - Biblioteca,"R Voluntários da Pßtria, 596",-46.626574395319835,-23.515323058012243
73,74,Narbal Fontes,"Av Cons. Moreira de Barros, 170",-46.62765727747954,-23.49679394195072
74,75,Bosque de Leitura da Aclimação,"R Muniz de Souza, 1119",-46.62891596503726,-23.572456445378712
75,76,Raul Bopp (Temática em Meio Ambiente - inaug. 30-4-2009),"R Muniz de Souza, 1.155",-46.62908699969394,-23.572605458419112
76,77,Pedro da Silva Nava,"Rua Helena do Sacramento, 1000",-46.63275126695331,-23.482726790852404
77,78,Bosque de Leitura da Luz,"R Ribeiro de Lima, 99 - Parque da Luz",-46.63409474994574,-23.53258815316513
78,79,CEU Caminho do Mar - Profa. Dulce Salles Cunha Braga,"Av Engenheiro Armando Arruda de Arruda Pereira, 5241",-46.63581103669059,-23.668280025162534
79,80,Memorial'32 - Centro de Estudos José Bourroul,"R Benjamim Constant, 158 - 4 andar",-46.6358109287009,-23.54960120757965
80,81,Viriato Correa (Temática em Literatura Fantástica - inaug. 29-11-2008)),"R Sena Madureira, 298",-46.638960430204136,-23.593270513162064
81,82,Ponto de Leitura Olido,"Av São  João, 473",-46.63931791029059,-23.543510181698167
82,83,Biblioteca de Braile - Centro Cultural São Paulo,"R Vergueiro, 1.000",-46.6405422191465,-23.570383323537595
83,84,Gibiteca Municipal Henfil - Centro Cultural SãoPaulo,"R Vergueiro, 1.000",-46.6405422191465,-23.570383323537595
84,85,Sergio Milliet (Inclui a Bibl. Alfredo Volpi (marþo/1983 - denom. Set/1996) e Discoteca Oneyda Alvar,"R Vergueiro, 1.000",-46.6405422191465,-23.570383323537595
85,86,CONDEPHAAT - Biblioteca,"R Mauá, 51",-46.64072784578307,-23.534882119847655
86,87,Acervo da Choque,"R Dr.Bráulio Gomes, n? 125/ 139 - Centro 01047-020",-46.6415840624907,-23.54727223097783
87,88,Mario de Andrade,"R da Consolação, 94",-46.64230898818349,-23.547271169125086
88,89,Mario de Andrade,"Rua Braúlio Gomes, 125/139",-46.64230898818349,-23.547271169125086
89,90,Raquel de Queiroz - CEU Alvarenga,"Estrada do Alvarenga, 3752  -  Balneário S. Francisco",-46.64470478069145,-23.70438515518
90,91,Paulo Duarte,"R Arsênio Tavolieri, 45",-46.6450941155433,-23.650890854991896
91,92,BMA - Biblioteca Circulante,"R da Consolação, 1.024",-46.651723263598015,-23.548194140815024
92,93,Narcisa Amélia Campos - CEU Navegantes,"R Maria Moassab Barbour, s/n",-46.660688742983176,-23.74403433520492
93,94,Bosque de Leitura - Ibirapuera,"Av Quarto Centenário, 1268 - Portão 7A",-46.66241189332564,-23.590986358266328
94,95,Espaço Sapucaia - Biblioteca,"Av IV Centenário, 1268, Portão 7 A",-46.66329196144702,-23.59430139433453
95,96,Centro Cultural da Juventude Ruth Cardoso,"Av Deputado Emílio Carlos, 3641",-46.67077693734146,-23.476292488340903
96,97,Menotti Del Picchia,"R São  Romualdo, 382",-46.67329706006448,-23.49714972154454
97,98,Ana Aurora do Amaral Lisboa - CEU Três Lagos,"Es do Barro Branco, s/n - J. Noronha",-46.68105952935685,-23.767346483191503
98,99,Alceu Amoroso Lima (Temática em Poesia - 02/09/2006),"R Henrique Schaumann, 777",-46.68251486260259,-23.558474071703873
99,100,Anne Frank,"R Cojuba, 45",-46.68446214710575,-23.58697133474319
100,101,Augusto dos Anjos - CEU Paz,"R da Paz, s/n",-46.689180967054305,-23.44801116635454
101,102,Ponto de Leitura Graciliano Ramos,"R  Prof. Oscar Barreto Filho, 252",-46.69206417266001,-23.73594327060524
102,103,CEU Vila Rubi,"R Domingos Tarroso, 101",-46.69750912278595,-23.727771206819682
103,104,Mario Schenberg (Temática em Ciências - inaug. 08-04-2008),"R Catão, 611",-46.70066181969189,-23.526656875595023
104,105,Thales Castanho de Andrade,"R Arthur Fajardo, 447",-46.70124349989397,-23.486546456272592
105,106,Alvaro Guerra,"R Pedroso de Morais, 1.919",-46.701262190312754,-23.55810005498034
106,107,Clarice Lispector,"R Jaricunas, 458",-46.70142496180677,-23.53550492686106
107,108,Afonso Schmidt,"Av Elísio T. Leite, 1.470",-46.70142645862573,-23.481365451384022
108,109,Rubem Braga - CEU Cidade Dutra,"Av Interlagos, 7.350 - Jdim. São  Nicolau",-46.70490693767302,-23.710872178658022
109,110,Belmonte (Temática em Cultura Popular - 04/08/2007),"R Paulo Eiró, 525",-46.70843319158463,-23.65058776101018
110,111,Prestes Maia,"Av João Dias, 822",-46.709006096929755,-23.64512273210334
111,112,Malba Tahan,"R Brás Pires Meira, 100",-46.7096486847265,-23.689515048001695
112,113,Cecília Meireles,"R Araçatuba, 522",-46.71095404715784,-23.53072086036064
113,114,CEU Jardim Paulistano,"R Aparecida do Taboado, s/n",-46.713665537727564,-23.462181180591536
114,115,Érico Verissimo,"R Diógenes Dourado, 101",-46.71614640644298,-23.44502893530238
115,116,Bosque de Leitura Rodrigo Gásperi,"Av Miguel de Castro, 321",-46.719276756485826,-23.481123323763292
116,117,Biblioteca Brasileira Guita e José Mindlin,"Rua da Biblioteca, s/n - Cidade Universitária",-46.72249449440191,-23.56222908118771
117,118,Bosque de Leitura Cidade de Toronto,"Av Cardeal Mota, 84",-46.723270015909065,-23.506794590334465
118,119,Carolina Maria de Jesus,"R Terezinha do Prado Oliveira, 119",-46.72334808213185,-23.828570829840295
119,120,Biblioteca Central da USP,Cidade Universitária,-46.726051521281235,-23.558701062570417
120,121,CEU Parelheiros,"R José Pedro de Borba, 20",-46.726668102608066,-23.82794882853576
121,122,CEU Paraisópolis,"R Doutor José Augusto Souza e Silva, s/n",-46.72790122595075,-23.62225752021825
122,123,Biblioteca Parque Villa Lobos,"Av. Prof. Fonseca Rodrigues, 2001",-46.728384453408744,-23.542228842702375
123,124,Ponto de Leitura - Casa de Cultura do Butantã,"R Junta Mizumoto, 13",-46.732874959642615,-23.587320233061114
124,125,Camila Cerqueira César,"R Valdemar Sanches, 41",-46.7384669031626,-23.575943120480442
125,126,Brito Broca,"Av Mutinga, 1.425",-46.74059014931565,-23.485907300580788
126,127,CEU Jaguaré,"Av Kenkiti Simomoto, 80",-46.74225772873946,-23.550212915092334
127,128,Patativa do Assare - CEU Casa Branca,"R João Damasceno, 85 - Jdim. Casa Blanca",-46.74453763901534,-23.64667073923927
128,129,Roberto Marinho - CEU Butantã,"Av Eng. Heitor Antônio Eiras Garcia, 1700 J.Esmeralda",-46.75024219139945,-23.58197117710744
129,130,Educador Paulo Freire - CEU Pera-Marmelo,"R Pera-Marmelo, 226 - Vila Aurora",-46.75088388693763,-23.436553712221297
130,131,João Antônio - CEU Perus,"R Bernardo José de Lourena, s/n",-46.751843626304115,-23.406007297445043
131,132,Padre José de Anchieta,"R Antônio Maia, 651",-46.755103701659024,-23.40724232419549
132,133,Bosque de Leitura Raposo Tavares,"R Telmo Coelho Filho, 200",-46.75658828340821,-23.58827522385422
133,134,Marcos Rey,"Av Anacê, 92",-46.75757658078819,-23.617782479118862
134,135,Maria Benedita Camara Bormann - CEU Vila AtlÔntica,"R Cel. José Venâncio Dias, 840 - J. Nardini",-46.76306245924735,-23.48142518232819
135,136,CEU Guarapiranga,"Es da Baronesa, 1.120",-46.76476558911202,-23.69657411357869
136,137,CEU Capão Redondo,R Daniel Gran. s/n,-46.770995331708136,-23.67452896707554
137,138,Ponto de Leitura Pc do Bambuzal,"R da Colônia Nova, s/n",-46.77337258665904,-23.68670102622774
138,139,Bosque de Leitura Santos Dias,"Estrada de Itapecirica, altura do 4800",-46.77394023282964,-23.659366832526306
139,140,Helena Silveira,"R Dr João B. Reimão, 146",-46.77448495712083,-23.63300760504317
140,141,Bosque de Leitura Anhanguera,"Av Fotunata Tadiello Natucci, 1000 (continuaçao da R Sílvio de Campos)",-46.778530146171654,-23.414350195816343
141,142,João do Rio - CEU Campo Limpo,"Av Carlos Lacerda, 678 - Chácara São Pedro",-46.779642109995876,-23.63699062929938
142,143,CEU Vila do Sol,"Av dos Funcionários Públicos, 369",-46.780858426181105,-23.736474333078277
143,144,CEU Canto do Amanhecer,R Prudêncio do Amaral com Av Cantos do Amanhecer,-46.78610127785423,-23.649256825103585
144,145,CEU Parque Anhanguera,R Pedro José de Lima. s/n,-46.78763644074419,-23.440460516675145
145,146,CEU Uirapuru,"R Nazir Miguel, s/n",-46.78951295070052,-23.600482303130846
146,147,CEU Feitiço da Vila,"R Feitiþo da Vila, s/n",-46.79378283785569,-23.686026080337715
147,148,Ponto de Leitura União dos Moradores do Parque Anhanguera,"R Amadeo Caego Monteiro, 209",-46.79583155958451,-23.42995133177033
148,149,Fábricas de Cultura,"Rua Antônio Ramos Rosa,37",-46.74934086161398,-23.661675820996248
149,150,Fábricas de Cultura,"Rua Conselheiro Moreira de Barros, 3977",-46.65068954097381,-23.47538160486813
150,151,Fábricas de Cultura,"Rua Bacia de São Francisco, s/n",-46.78725362675571,-23.678631034709472
151,152,Fábricas de Cultura,"Rua Raimundo Eduardo da Silva, 138",-46.57912116951508,-23.450666866061237
152,153,Fábricas de Cultura,"Rua General Penha Brasil, 2508",-46.67535877288375,-23.452727300775255
153,154,Fábricas de Cultura,"Rua Pedra Dourada, 65 - Jardim Rubru",-46.40726153662438,-23.525745512918675
154,155,Fábricas de Cultura,"Rua Augustin Luberti, 300",-46.488402455286,-23.614639437993244
155,156,Fábricas de Cultura,"Rua Estudantes da China, 500",-46.37257884383328,-23.50174461619972
156,157,Fábricas de Cultura,"Av. Celso Garcia, 2231",-46.58870590043684,-23.535010449153233
157,158,Fábricas de Cultura,"Rua Henriqueta Noguez Brieba, 281",-46.418778950713765,-23.568586729212136
158,159,Centro de Formaçao Cultural da Cidade de Tiradentes,"Av Inácio Monteiro, 6900",-46.38989551795017,-23.58016099410183
159,160,CC do Itaim Paulista,"R Barão de Alagoas, 340",-46.397535213465304,-23.49824842996539
160,161,Centro Cultural Arte em Construção,"Av dos Metal·rgicos, 2.100",-46.39940870883083,-23.600926030056115
161,162,Instituto Cultural Arte em Construção - Instituto Pombas Urbanas,"R dos Metal·rgicos, 2.100",-46.39940870883083,-23.600926030056115
162,163,Casa de Cultura Cidade Tiradentes (Casa da Fazenda),"Av Sarah Kubitschek,165",-46.406626773299465,-23.583085853075467
163,164,CC Chico Mendes,"R Cembira, 1.202",-46.42928583058929,-23.506785229785812
164,165,CC São Miguel Paulista,"R Irineu Bonardi, 169",-46.43764794911762,-23.49532004559235
165,166,CC Raul Seixas,"R Murmúrios da Tarde, 211 Parque Raul Seixas Cohab II",-46.443940328741604,-23.552806424343697
166,167,Casa de Cultura Antônio Marcos,"Rua Irineu Bonardi 169, Vila Pedroso",-46.450732199409515,-23.495974023916485
167,168,Alfredo Volpi,"R Victorio Santim, 206",-46.45340243109914,-23.537863230680784
168,169,Casa de Cultura Sao Mateus,"R José Francisco dos Santos, 502",-46.48939036930759,-23.598620372226886
169,170,Centro Cultural da Penha,"Lg do Rosário, 20, 3 andar",-46.54873312437462,-23.525862573624803
170,171,Raul Seixas,"R Inspetor Mário Teixeira, 70",-46.566548595926065,-23.55610069747189
171,172,CC do Tatuapé,"R Guabiju, 49",-46.582596789675456,-23.533321431666252
172,173,"Oficina Cultural do Brás ""AMÂNCIO MAZZAROPI""","R Visconde de Parnaiba, 2.437",-46.60402030204691,-23.543688397397915
173,174,CC Chico Science (Antiga CC do Ipiranga),"Av Tancredo Neves, 1.265",-46.60937003841897,-23.6169448152775
174,175,Casa de Cultura Tremembé,"R Maria Amélia Lopes Azevedo, 190",-46.622792944165965,-23.460999683596217
175,176,Liceu de Artes e Ofícios,"R da Cantareira, 1.351",-46.62690357420218,-23.533029153363863
176,177,Espaço Cultural Classes Laboriosas,"R Roberto Simonsen,  22",-46.63200985620049,-23.549594279517326
177,178,Caixa Cultural,"Pc da Sé, 111",-46.633076904121836,-23.5492012752355
178,179,Conjunto Cultural da Caixa,"Pc da Sé, 111 - 3 andar",-46.633076904121836,-23.5492012752355
179,180,Espaço Bovespa,"R 15 de Novembro, 272",-46.634496885531654,-23.546307221141944
180,181,Espaço Cultural BM&F,"Pc Antônio Prado, 48",-46.634524905973244,-23.54547622784493
181,182,Espaço Cultural da Bolsa de Mercadorias & Futuros,"Pc Antônio Prado, 48",-46.634524905973244,-23.54547622784493
182,183,Espaço Nossa Caixa,"R Álvares Penteado, 70, 2 mezanino",-46.63479985876392,-23.548018261120486
183,184,Centro Cultural do Banco do Brasil,"R Álvares Penteado, 112",-46.63486391375775,-23.547495274405133
184,185,Centro Cultural Correios,"Edificio Central dos Correios - Av. São João, s/nº Vale do Anhangabaú",-46.636883930953026,-23.54393324100955
185,186,Oficina Cultural Oswald de Andrade,"R Três Rios, 363",-46.63804475126878,-23.529635151133373
186,187,Espaço Cultural Santo Agostinho (Colégio),"R Apeninos, 118",-46.63929221358277,-23.569332387239545
187,188,Galeria Olido,"Av São  João, 473 - Mezanino",-46.63931791029059,-23.543510181698167
188,189,Universidade Livre de Música Tom Jobim,"R Gal Osório, 147",-46.63933889477649,-23.535543151621457
189,190,Instituto Cultural Usiminas,"Av do Café, 277",-46.64023383694994,-23.634751767595144
190,191,Centro Cultural São Paulo,"R Vergueiro, 1.000",-46.6405422191465,-23.570383323537595
191,192,Espaço Cultura-IBEP Nacional,"R Santo Amaro, 766",-46.64068306178238,-23.55620529232432
192,193,Estação Júlio Prestes,"R Maua, 51",-46.64072784578307,-23.534882119847655
193,194,Instituto de Arte Contemporânea -  IAC,"Rua Álvaro Alvim, 90 - 1º andar",-46.641303394777346,-23.589399513168136
194,195,Centro Cultural Copobianco,"R Álvaro de Carvalho, 97",-46.64147298956851,-23.54873125386278
195,196,"Acervo da Memória e do Viver Afro-Brasileira Caio Egydio Aranha, antigo Centro Cultural Jabaquara","R Arsênio Tavolieri, 45",-46.6450941155433,-23.650890854991896
196,197,Sala Pretérito Perfeito,"Lg do Arouche, 99",-46.645235008212055,-23.541812136899946
197,198,Casa das Rosas - Galeria,"Av Paulista, 37",-46.64523733784209,-23.57125332705527
198,199,Espaço Cultural Fundação Japão,"Av Paulista, 37-10 andar",-46.64523733784209,-23.57125332705527
199,200,Centro Cultural Santa  Catarina,"Av Paulista , 200",-46.645609280632186,-23.56966232115334
200,201,Itaú Cultural,"Av Paulista, 149",-46.64633634309109,-23.57054536448411
201,202,Associação Palas Athena,"R Leôncio de Carvalho, 99",-46.64636333826207,-23.571162296279454
202,203,Espaço Cultural Porto Seguro,"Av Rio Branco, 1489",-46.64669994041949,-23.53156107338686
203,204,Espaço Cultural dos Bancários Lelia Abramo,"R Carlos Sampaio, 305",-46.64678128528893,-23.568336274789985
204,205,Matilha Cultural,"R Rego Freitas, 542",-46.647208105549765,-23.54674318785489
205,206,Centro Cultural  SESC Vila Nova,R Dr Vila Nova s/n,-46.6505061959623,-23.546099128230395
206,207,Instituto Universitário Maria Antônia,"R Maria Antônia, 294 - 2 andar",-46.651207160145404,-23.546125189641103
207,208,Gabinete do Desenho/Chácata Lane,"R da Consolação, 1024",-46.651723263598015,-23.548194140815024
208,209,Espaço Cultural Citigroup,"Av Paulista, 1111, TÚrreo",-46.6537084458238,-23.564967222320135
209,210,Banco Real,"Av Paulista, 1374",-46.65454144704849,-23.56239620826156
210,211,Centro Cultural FIESP,"Av Paulista, 1.313",-46.65475847299178,-23.56359528049757
211,212,OCA - Pavilhão Lucas Nogueira Garcez,"R Pedro Álvares Cabral, s/n - Portão 2 e 3, Pavilhão Lucas Nogueira",-46.655880652855046,-23.586971415433418
212,213,Instituto Cultural Ítalo Brasileiro,"R Frei Caneca,1071",-46.656671376163885,-23.55651118452061
213,214,Espaço Cultural do Banco Central,"Av Paulista, 1.804",-46.657566409628544,-23.55976517009942
214,216,Casa Mario de Andrade (Oficina da Palavra),"R Lopes Chaves, 546",-46.66056519249852,-23.530701045588643
215,217,Galeria da Consolação,Pass. subterrânea entre Av Paulista (altura do número 2.423 da R da Consolação),-46.662586540578495,-23.555755150279357
216,218,Joh Mabe,"Av. Brig. Luís Antônio, 4225",-46.662883812823665,-23.580039338961747
217,219,Espaço Cultural Life,"Av Brasil, 298",-46.663760794971395,-23.577095317655715
218,220,Memorial da América Latina,"Av Auro Soares de Moura Andrade, 664",-46.66580124671247,-23.527619947140984
219,221,Gabriel Wickbold Studio & Gallery,"Rua Lourenço de Almeida, 167",-46.66619391206953,-23.588959368662223
220,222,Instituto Camões,R Canadá. 324,-46.66749675006347,-23.571998183144174
221,223,Espaço Cultural Pyndorama,"R Turiaþ·, 481",-46.66806642212606,-23.533583990124757
222,224,Galeria Marcelo Guarnieri,"Alameda Lorena, 1966",-46.66923364114726,-23.561129138671884
223,225,Centro Cultural da Juventude Ruth Cardoso,"Av Deputado Emílio Carlos, 3641",-46.67077693734146,-23.476292488340903
224,226,Unibes Cultural,"R Oscar Freire,  2.500",-46.67876476446116,-23.550939101452208
225,227,Instituto Goethe,"R Lisboa, 974",-46.68194587399357,-23.55605508737033
226,228,Casa de Cultura Cora Coralina,"R Santana, 201 Vila São  Pedro",-46.68223206386258,-23.67083286495497
227,229,SESC Fabrica Pompeia,R Clélia s/n,-46.68387054855909,-23.52548988140126
228,230,Espaço Cultural Letras & Forma,"R Cap. Antônio Rosa, 454",-46.68523602390701,-23.56692318819249
229,231,Instituto Cultural Tchekov,"R Fradique Coutinho, 825",-46.68917095321451,-23.56010111003988
230,232,Espaço Cultural Bambu Brasil,"R Purpurina,  272",-46.691300972454016,-23.553622042456926
231,233,Casa de Cultura Palhaço Carequinha,"R Prof. Oscar Barreto Filho, 252",-46.69201919356612,-23.735658326405094
232,234,Instituto Cine Cultural,"Av Rebouþas, 3.507",-46.69243619499025,-23.57226421272921
233,235,Instituto Tomie Ohtake,"Av Faria Lima, 201",-46.69505805907418,-23.56110611950647
234,236,KVA - Centro Cultural Elenko,"R Cardeal  Arcoverde, 2.958",-46.6956562053992,-23.56996915383821
235,237,Espaço Cultural  Tendal da Lapa,"R Guaicurus, 1.100",-46.696417677931315,-23.522328805438168
236,238,Espaço Annablume,"R Pe. Cavalho, 275",-46.696585162057815,-23.56234212118598
237,239,Centro Cultural Brasileiro Britanico,"R Ferreira de Araújo, 741",-46.69767717663442,-23.56418209590402
238,240,Centro Cultural SESC Pinheiros,"R Paes Leme, 195",-46.698159205368306,-23.568078107330447
239,241,Casa da Cultura Brasilandia,"Pç Benedita Cavalheiro, s/n",-46.69960332306475,-23.470348330404075
240,242,CC Salvador Ligabue (Antiga CC da Freguesia do Ó),"Lg da Matriz, 215",-46.69995262277843,-23.50190665092087
241,243,Espaço Cultural Bank Boston,"Av Dr Chucri Zaidan, 246",-46.70018872395977,-23.62126956956767
242,244,CC de Interlagos,"R Padre José  Garzotti, 545",-46.703507945830175,-23.711686098985886
243,245,Casa Amarela,"Pc Floriano Peixoto, 130",-46.70798921019002,-23.65103873288239
244,246,CC de Santo Amaro,"Pc Francisco Ferreira Lopes, 434",-46.70883612224264,-23.646472691785373
245,247,Casa de Cultura e Convívio da Lapa,"R Araçatuba, 522",-46.71095404715784,-23.53072086036064
246,248,Casa de Vidro,"R. Gen. Almério de Moura, 200",-46.71245490944799,-23.613169439514827
247,249,Oficina Cultural Maestro Juan Serrano,"R Joaquim Pimentel, 200",-46.71289333738401,-23.444341001630914
